{
  "schemaVersion": "1.1.0",
  "moduleKey": "landmarks",
  "pageKind": "module-home",
  "pageId": "aebd1fc3-a735-4910-a00b-0a8d19068014",
  "slug": "landmarks",
  "locale": "uk",
  "translationGroupId": "tg_landmarks_module_home",
  "meta": {
    "title": "Landmarks",
    "tags": [
      "landmarks",
      "module-home"
    ],
    "status": "published"
  },
  "hero": {
    "headline": "Привіт. Це я, Кетті.",
    "kicker": "Sannata"
  },
  "sections": [
    {
      "id": "sec_module_home_block_1",
      "type": "custom:module-home-block",
      "visible": true,
      "payload": {
        "title": "",
        "text": "Я не знаю, де ти зараз,\r\nале я вирішила написати тобі.\r\n\r\nЯ люблю ходити містами.\r\nІноді — довго.\r\nІноді — зовсім трішки.\r\nЯ не завжди знаю, куди йду.\r\nІноді я обираю місце,\r\nбо в нього гарне ім’я.\r\nІноді — бо там дивні сходи.\r\nІноді — бо пішов дощ,\r\nі здалося, що він мене покликав.\r\nЯ дивлюся не так, як дорослі.\r\nЯ дивлюся на тріщини, на тіні,\r\nна вікна, які ніби щось знають.\r\nЯ слухаю, як звучить місце.\r\nДеякі місця шепочуть.\r\nДеякі мовчать.\r\nА деякі починають розповідати одразу.\r\nКоли я приходжу в дуже гарне місце,\r\nя спершу стою.\r\nПотім обходжу навколо.\r\nПотім торкаюся його поглядом.\r\nІноді мені нічого сказати.\r\nТоді я просто запам’ятовую,\r\nяк пахнув ранок\r\nі якого кольору було небо між будинками.\r\nА потім я пишу листівку.\r\nНе довгу.\r\nНе про все.\r\nЛише про те,\r\nщо залишилося зі мною.\r\nІноді це слова.\r\nІноді — майже вірш.\r\nІноді — просто відчуття,\r\nяке я не хочу загубити.\r\nЯ подорожуватиму далі.\r\nБез маршруту.\r\nБез правильних відповідей.\r\nІ щоразу,\r\nколи місце торкнеться мене,\r\nти отримаєш від мене листівку.",
        "illustrationLeft": "## D. Иллюстрация блока 1 - Справа",
        "illustrationRight": "/uploads/module-home/illustration1R-1772566361555.png"
      }
    },
    {
      "id": "sec_module_home_block_2",
      "type": "custom:module-home-block",
      "visible": true,
      "payload": {
        "title": "",
        "text": "",
        "illustrationLeft": "/uploads/module-home/illustration2L-1772566391266.png",
        "illustrationRight": "## D. Иллюстрация блока 3 - Слева"
      }
    },
    {
      "id": "sec_module_home_block_3",
      "type": "custom:module-home-block",
      "visible": true,
      "payload": {
        "title": "",
        "text": "",
        "illustrationLeft": "## D. Иллюстрация блока 3 - Справа",
        "illustrationRight": "/uploads/module-home/illustration3R-1772566444610.png"
      }
    },
    {
      "id": "sec_module_home_closing",
      "type": "custom:module-home-closing",
      "visible": true,
      "payload": {
        "text": "Листівки приходять не за розкладом."
      }
    }
  ],
  "mediaRefs": {
    "hero": [
      "/uploads/module-home/stampImage-1772449138482.png"
    ],
    "sections": [
      "## D. Иллюстрация блока 1 - Справа",
      "/uploads/module-home/illustration1R-1772566361555.png",
      "/uploads/module-home/illustration2L-1772566391266.png",
      "## D. Иллюстрация блока 3 - Слева",
      "## D. Иллюстрация блока 3 - Справа",
      "/uploads/module-home/illustration3R-1772566444610.png"
    ]
  },
  "audit": {
    "createdAt": "2026-03-03T20:05:56.463Z",
    "updatedAt": "2026-03-06T12:42:22.963Z",
    "updatedBy": "agent-form"
  },
  "navigation": {
    "parentId": null,
    "childrenIds": [],
    "siblings": [],
    "breadcrumbs": [
      {
        "pageId": "aebd1fc3-a735-4910-a00b-0a8d19068014",
        "title": "Landmarks",
        "slug": "landmarks"
      }
    ]
  }
}