{
  "schemaVersion": "1.1.0",
  "moduleKey": "landmarks",
  "pageKind": "module-home",
  "pageId": "3f451b60-5b8b-4801-a538-c83dde8e2092",
  "slug": "landmarks",
  "locale": "ru",
  "translationGroupId": "tg_landmarks_module_home",
  "meta": {
    "title": "Landmarks",
    "tags": [
      "landmarks",
      "module-home"
    ],
    "status": "published"
  },
  "hero": {
    "headline": "Привет. Это я, Кетти.",
    "kicker": "Sannata"
  },
  "sections": [
    {
      "id": "sec_module_home_block_1",
      "type": "custom:module-home-block",
      "visible": true,
      "payload": {
        "title": "",
        "text": "Я не знаю, где ты сейчас, \r\nно я решила писать тебе.\r\n\r\nЯ люблю ходить по городам.\r\nИногда — долго.\r\nИногда — совсем чуть чуть.\r\nЯ не всегда знаю, куда иду.\r\nИногда я выбираю место, потому что у него красивое имя.\r\nИногда — потому что там странная лестница.\r\nИногда — потому что пошёл дождь, и он будто позвал меня.\r\nЯ смотрю не как взрослые.\r\nЯ смотрю на трещины, на тени, на окна, которые будто что то знают.\r\nЯ слушаю, как звучит место.\r\nНекоторые места шепчут.\r\nНекоторые молчат.\r\nА некоторые сразу начинают рассказывать.\r\nКогда я прихожу в очень красивое место,\r\nя сначала стою.\r\nПотом обхожу вокруг.\r\nПотом трогаю взглядом.\r\nИногда мне нечего сказать.\r\nТогда я просто запоминаю,\r\nкак пахло утро\r\nи какого цвета было небо между домами.\r\nА потом я пишу открытку.\r\nНе длинную.\r\nНе про всё.\r\nТолько про то,\r\nчто осталось со мной.\r\nИногда это слова.\r\nИногда — почти стих.\r\nИногда — просто чувство,\r\nкоторое я не хочу потерять.\r\nЯ буду путешествовать дальше.\r\nБез маршрута.\r\nБез правильных ответов.\r\nИ каждый раз,\r\nкогда место меня тронет,\r\nты получишь от меня открытку.",
        "illustrationLeft": "",
        "illustrationRight": "/uploads/module-home/illustration1R-1772566361555.png"
      }
    },
    {
      "id": "sec_module_home_block_2",
      "type": "custom:module-home-block",
      "visible": true,
      "payload": {
        "title": "",
        "text": "",
        "illustrationLeft": "/uploads/module-home/illustration2L-1772566391266.png",
        "illustrationRight": ""
      }
    },
    {
      "id": "sec_module_home_block_3",
      "type": "custom:module-home-block",
      "visible": true,
      "payload": {
        "title": "",
        "text": "",
        "illustrationLeft": "",
        "illustrationRight": "/uploads/module-home/illustration3R-1772566444610.png"
      }
    },
    {
      "id": "sec_module_home_closing",
      "type": "custom:module-home-closing",
      "visible": true,
      "payload": {
        "text": "Открытки приходят не по расписанию."
      }
    }
  ],
  "mediaRefs": {
    "hero": [
      "/uploads/module-home/stampImage-1772449138482.png"
    ],
    "sections": [
      "/uploads/module-home/illustration1R-1772566361555.png",
      "/uploads/module-home/illustration2L-1772566391266.png",
      "/uploads/module-home/illustration3R-1772566444610.png"
    ]
  },
  "audit": {
    "createdAt": "2026-03-03T20:05:56.463Z",
    "updatedAt": "2026-03-06T17:31:18.760Z",
    "updatedBy": "agent-form"
  },
  "navigation": {
    "parentId": null,
    "childrenIds": [],
    "siblings": [],
    "breadcrumbs": [
      {
        "pageId": "3f451b60-5b8b-4801-a538-c83dde8e2092",
        "title": "Landmarks",
        "slug": "landmarks"
      }
    ]
  }
}